{"artifacts":[{"generating_phase":"P10","input_artifact_sha256s":["4024fa67d812cf8e7c95e3e71fba7acb8eb5b93529e14e6b00e87002c4e0670b"],"media_type":"text/markdown","path":"promax-case-and-countercase.md","sha256":"3ee20b5b766ff363218423e4982b691fe5b911e783941953891dd300c8f352f6","status":"current"},{"generating_phase":"P5","input_artifact_sha256s":["da7d28f8e11858743239de923dacf9712d545e9823524c1c342d4ec34b074c4b"],"media_type":"application/json","path":"promax-claim-path-graph.json","sha256":"7effe9463ef379954333508156d8e9f019627b61f0c0fec7b777118ec1142b87","status":"current"},{"generating_phase":"P10","input_artifact_sha256s":["4024fa67d812cf8e7c95e3e71fba7acb8eb5b93529e14e6b00e87002c4e0670b"],"media_type":"text/markdown","path":"promax-concept-atlas.md","sha256":"4590ca470f7c8a3b1455e25c71566d64c7a53ffb9a6bfb6490e40df498a0fbbe","status":"current"},{"generating_phase":"P4","input_artifact_sha256s":["d1d7fec4d96a4d5244ea616bafcc8f5cada1956f81507ca6a2af20844a62a0be"],"media_type":"application/json","path":"promax-concept-disposition-ledger.json","sha256":"da7d28f8e11858743239de923dacf9712d545e9823524c1c342d4ec34b074c4b","status":"current"},{"generating_phase":"P10","input_artifact_sha256s":["4024fa67d812cf8e7c95e3e71fba7acb8eb5b93529e14e6b00e87002c4e0670b"],"media_type":"text/markdown","path":"promax-continuation-index.md","sha256":"af44d250b65b19414ff718c6b48f6c3497bc2309e6c26c28eb0cad17e03c81b9","status":"current"},{"generating_phase":"P10","input_artifact_sha256s":["4024fa67d812cf8e7c95e3e71fba7acb8eb5b93529e14e6b00e87002c4e0670b"],"media_type":"text/markdown","path":"promax-dossier.md","sha256":"1ee3d21201d020fef2669f0a88f4fb17fb4244af721163fc3fa5b456b39fc1e9","status":"current"},{"generating_phase":"P10","input_artifact_sha256s":["4024fa67d812cf8e7c95e3e71fba7acb8eb5b93529e14e6b00e87002c4e0670b"],"media_type":"text/markdown","path":"promax-essay.md","sha256":"7feabaad027bd7fe5c1a7dacb0acfb869b79de53b11af9e2f8c1049ab872c5d2","status":"current"},{"generating_phase":"P3","input_artifact_sha256s":["cd89758cda3ec5d64879cc62a302db0cf6d0a6b8dee721d25ff52eb612506172"],"media_type":"application/json","path":"promax-local-world-model.locked.json","sha256":"d1d7fec4d96a4d5244ea616bafcc8f5cada1956f81507ca6a2af20844a62a0be","status":"current"},{"generating_phase":"P9","input_artifact_sha256s":["a6e03c39293b603bc53406405bc094f239b391dcc636dea0e49854f5e09efd38","e61b14e15ba3355d5b0d21066522278e479c4b759f4475984596c192c3f84499"],"media_type":"application/json","path":"promax-output-plan.locked.json","sha256":"4024fa67d812cf8e7c95e3e71fba7acb8eb5b93529e14e6b00e87002c4e0670b","status":"current"},{"generating_phase":"P8","input_artifact_sha256s":["9d3c1ef8dad39ad95e3c2eb766d148f55cbdc37e7c7fc5a901997b31495bbeeb"],"media_type":"application/json","path":"promax-position.locked.json","sha256":"a6e03c39293b603bc53406405bc094f239b391dcc636dea0e49854f5e09efd38","status":"current"},{"generating_phase":"P1","input_artifact_sha256s":["2cd897536fc625a0503a90596a66637c21e3dd9d6b8d8bb94e831f9e6c78c8c5"],"media_type":"application/x-ndjson","path":"promax-read-events.jsonl","sha256":"35fd443221d7293f5fefa7a226919749c1f4eabd166f4db52f0a3cf64526928c","status":"current"},{"generating_phase":"P8","input_artifact_sha256s":["a6e03c39293b603bc53406405bc094f239b391dcc636dea0e49854f5e09efd38"],"media_type":"application/json","path":"promax-recommendation.locked.json","sha256":"e61b14e15ba3355d5b0d21066522278e479c4b759f4475984596c192c3f84499","status":"current"},{"generating_phase":"P7","input_artifact_sha256s":["2fb953f6d3272bbcbe9195d1cc5174fb812c8825165ebd5c615ef1860da2a2b9"],"media_type":"application/json","path":"promax-red-team-report.json","sha256":"9d3c1ef8dad39ad95e3c2eb766d148f55cbdc37e7c7fc5a901997b31495bbeeb","status":"current"},{"generating_phase":"P6","input_artifact_sha256s":["7effe9463ef379954333508156d8e9f019627b61f0c0fec7b777118ec1142b87"],"media_type":"application/json","path":"promax-retrieval-ledger.json","sha256":"2fb953f6d3272bbcbe9195d1cc5174fb812c8825165ebd5c615ef1860da2a2b9","status":"current"},{"generating_phase":"P0","input_artifact_sha256s":[],"media_type":"application/json","path":"promax-source-snapshot.json","sha256":"2cd897536fc625a0503a90596a66637c21e3dd9d6b8d8bb94e831f9e6c78c8c5","status":"current"},{"generating_phase":"P2","input_artifact_sha256s":["35fd443221d7293f5fefa7a226919749c1f4eabd166f4db52f0a3cf64526928c"],"media_type":"text/markdown","path":"promax-worldview-capsule.locked.md","sha256":"cd89758cda3ec5d64879cc62a302db0cf6d0a6b8dee721d25ff52eb612506172","status":"current"}],"generated_at":"2026-07-23T09:50:00Z","manifest_sha256":"a7940ff18e27c20af5709f13efe93fa914b2e350aabab742d592958784254d26","mode":"promax-complete","orchestration_mode":"single-agent-separated","phase_chain_head_sha256":"65a0b8fe0f91d83ace1c84b3914d61a571349492828af50a58b0003c67ba1282","request_sha256":"ad8a63541e42943ecf7ae1ca329a138a01c9355d7ffe353e9565c0f711f92e99","role_records":[{"exchange_protocol":"structured-artifacts-only","execution_mode":"single-agent-separated","input_artifacts":[{"media_type":"application/json","path":"promax-local-world-model.locked.json","sha256":"d1d7fec4d96a4d5244ea616bafcc8f5cada1956f81507ca6a2af20844a62a0be"}],"observed_input_artifacts":[{"media_type":"application/json","path":"promax-local-world-model.locked.json","sha256":"d1d7fec4d96a4d5244ea616bafcc8f5cada1956f81507ca6a2af20844a62a0be"}],"output_artifacts":[{"media_type":"application/json","path":"promax-concept-disposition-ledger.json","sha256":"da7d28f8e11858743239de923dacf9712d545e9823524c1c342d4ec34b074c4b"}],"role_id":"v8_source_concept_auditor","sequence":1,"status":"completed"},{"exchange_protocol":"structured-artifacts-only","execution_mode":"single-agent-separated","input_artifacts":[{"media_type":"application/json","path":"promax-claim-path-graph.json","sha256":"7effe9463ef379954333508156d8e9f019627b61f0c0fec7b777118ec1142b87"}],"observed_input_artifacts":[{"media_type":"application/json","path":"promax-claim-path-graph.json","sha256":"7effe9463ef379954333508156d8e9f019627b61f0c0fec7b777118ec1142b87"}],"output_artifacts":[{"media_type":"application/json","path":"promax-retrieval-ledger.json","sha256":"2fb953f6d3272bbcbe9195d1cc5174fb812c8825165ebd5c615ef1860da2a2b9"}],"role_id":"external_case_researcher","sequence":2,"status":"completed"},{"exchange_protocol":"structured-artifacts-only","execution_mode":"single-agent-separated","input_artifacts":[{"media_type":"application/json","path":"promax-retrieval-ledger.json","sha256":"2fb953f6d3272bbcbe9195d1cc5174fb812c8825165ebd5c615ef1860da2a2b9"}],"observed_input_artifacts":[{"media_type":"application/json","path":"promax-retrieval-ledger.json","sha256":"2fb953f6d3272bbcbe9195d1cc5174fb812c8825165ebd5c615ef1860da2a2b9"}],"output_artifacts":[{"media_type":"application/json","path":"promax-red-team-report.json","sha256":"9d3c1ef8dad39ad95e3c2eb766d148f55cbdc37e7c7fc5a901997b31495bbeeb"}],"role_id":"counterexample_auditor","sequence":3,"status":"completed"},{"exchange_protocol":"structured-artifacts-only","execution_mode":"single-agent-separated","input_artifacts":[{"media_type":"application/json","path":"promax-red-team-report.json","sha256":"9d3c1ef8dad39ad95e3c2eb766d148f55cbdc37e7c7fc5a901997b31495bbeeb"}],"observed_input_artifacts":[{"media_type":"application/json","path":"promax-red-team-report.json","sha256":"9d3c1ef8dad39ad95e3c2eb766d148f55cbdc37e7c7fc5a901997b31495bbeeb"}],"output_artifacts":[{"media_type":"application/json","path":"promax-position.locked.json","sha256":"a6e03c39293b603bc53406405bc094f239b391dcc636dea0e49854f5e09efd38"}],"role_id":"position_adjudicator","sequence":4,"status":"completed"},{"exchange_protocol":"structured-artifacts-only","execution_mode":"single-agent-separated","input_artifacts":[{"media_type":"application/json","path":"promax-output-plan.locked.json","sha256":"4024fa67d812cf8e7c95e3e71fba7acb8eb5b93529e14e6b00e87002c4e0670b"}],"observed_input_artifacts":[{"media_type":"application/json","path":"promax-output-plan.locked.json","sha256":"4024fa67d812cf8e7c95e3e71fba7acb8eb5b93529e14e6b00e87002c4e0670b"}],"output_artifacts":[{"media_type":"text/markdown","path":"promax-essay.md","sha256":"7feabaad027bd7fe5c1a7dacb0acfb869b79de53b11af9e2f8c1049ab872c5d2"}],"role_id":"longform_writer","sequence":5,"status":"completed"}],"run_contract_sha256":"dac0f26ddc6208cef6f4a781c63b16d153ee592e1280f8d3b889c6b71483c905","run_id":"promax-green-v4-gpt-5-6-sol-a2-9742973771c64e89813a768c7894faa8","run_nonce":"b93edb6ee221f2443b6e8819805f3e9e108f4e86147647c4911ca077ef78cb37","schema_id":"crossframe.promax.v8.artifact-manifest","schema_version":1,"source_snapshot_sha256":"3186805a3e46e1b16948a4e51d08e7693a8e0dd04aa6b4604e796266d649936c"}
