{"artifacts":[{"generating_phase":"P10","input_artifact_sha256s":["fd17b4a4eecf0d5662460378e84265009ecd6978c1d341ee38e5d90304878f23"],"media_type":"text/markdown","path":"promax-case-and-countercase.md","sha256":"6a56ae7a097394346221bf48a679ef48e0112350af170ce5c9cfcada615743a9","status":"current"},{"generating_phase":"P5","input_artifact_sha256s":["f137e63bf72407a2ebd4e0a88c86e39b012722f760fcb35b7fbb747a727f68a1"],"media_type":"application/json","path":"promax-claim-path-graph.json","sha256":"697f77250b70ffe1a4282229607f4d59e1f94dab0a4953d5904cc8ee34edd4b4","status":"current"},{"generating_phase":"P10","input_artifact_sha256s":["fd17b4a4eecf0d5662460378e84265009ecd6978c1d341ee38e5d90304878f23"],"media_type":"text/markdown","path":"promax-concept-atlas.md","sha256":"73405852973469b448cb3aefa2af71568ccc40f8d491b6e6f6649cfeb4338601","status":"current"},{"generating_phase":"P4","input_artifact_sha256s":["a5a3a0b64012c0ad08298f9ea2784f3e7460ad1db51cbb4d25d1f6bd206c7102"],"media_type":"application/json","path":"promax-concept-disposition-ledger.json","sha256":"f137e63bf72407a2ebd4e0a88c86e39b012722f760fcb35b7fbb747a727f68a1","status":"current"},{"generating_phase":"P10","input_artifact_sha256s":["fd17b4a4eecf0d5662460378e84265009ecd6978c1d341ee38e5d90304878f23"],"media_type":"text/markdown","path":"promax-continuation-index.md","sha256":"858f7d3168e29257ec85a976972915a1add0cdaa8a42d3bfdfd5a8d7bbf4e264","status":"current"},{"generating_phase":"P10","input_artifact_sha256s":["fd17b4a4eecf0d5662460378e84265009ecd6978c1d341ee38e5d90304878f23"],"media_type":"text/markdown","path":"promax-dossier.md","sha256":"9de3adce357b6f72406f3e4c63d53c3e1abe98a19dac6f0cb4b81790aae52dea","status":"current"},{"generating_phase":"P10","input_artifact_sha256s":["fd17b4a4eecf0d5662460378e84265009ecd6978c1d341ee38e5d90304878f23"],"media_type":"text/markdown","path":"promax-essay.md","sha256":"dc69659fe01457351c6f7a25205b3af6db5f3f292106af86eb635b60e42d1712","status":"current"},{"generating_phase":"P3","input_artifact_sha256s":["8d6a71be235ffe57b308093b8de778c2310eeac447f53b63bdb3f9fcabdc222e"],"media_type":"application/json","path":"promax-local-world-model.locked.json","sha256":"a5a3a0b64012c0ad08298f9ea2784f3e7460ad1db51cbb4d25d1f6bd206c7102","status":"current"},{"generating_phase":"P9","input_artifact_sha256s":["df2ce3fb6d1bf1cb6933fda1c63e0ea717a7841f6679d2e3435179278aa284b1","f441e8ac49b23139e08045826865e76f45ea74ff665746d8f46bf88bc8493a74"],"media_type":"application/json","path":"promax-output-plan.locked.json","sha256":"fd17b4a4eecf0d5662460378e84265009ecd6978c1d341ee38e5d90304878f23","status":"current"},{"generating_phase":"P8","input_artifact_sha256s":["6c9a3a1c32a6562215f5f0ef98c0ab7023ac144fd734973f1338b880fd1fb6ca"],"media_type":"application/json","path":"promax-position.locked.json","sha256":"df2ce3fb6d1bf1cb6933fda1c63e0ea717a7841f6679d2e3435179278aa284b1","status":"current"},{"generating_phase":"P1","input_artifact_sha256s":["9f5c6275d66f0fbc523ff8a1c3e338728eaebc1a0a0ab3a410736ea3195faa4f"],"media_type":"application/x-ndjson","path":"promax-read-events.jsonl","sha256":"5d6c500938980a7cd46ab70f451ca2f619361d66aa0296d2693153cb3e2ec925","status":"current"},{"generating_phase":"P8","input_artifact_sha256s":["df2ce3fb6d1bf1cb6933fda1c63e0ea717a7841f6679d2e3435179278aa284b1"],"media_type":"application/json","path":"promax-recommendation.locked.json","sha256":"f441e8ac49b23139e08045826865e76f45ea74ff665746d8f46bf88bc8493a74","status":"current"},{"generating_phase":"P7","input_artifact_sha256s":["0c0430c4bec5185238e642371c9646632bfbeedc30d0ad1cfa02c4705f7ec617"],"media_type":"application/json","path":"promax-red-team-report.json","sha256":"6c9a3a1c32a6562215f5f0ef98c0ab7023ac144fd734973f1338b880fd1fb6ca","status":"current"},{"generating_phase":"P6","input_artifact_sha256s":["697f77250b70ffe1a4282229607f4d59e1f94dab0a4953d5904cc8ee34edd4b4"],"media_type":"application/json","path":"promax-retrieval-ledger.json","sha256":"0c0430c4bec5185238e642371c9646632bfbeedc30d0ad1cfa02c4705f7ec617","status":"current"},{"generating_phase":"P0","input_artifact_sha256s":[],"media_type":"application/json","path":"promax-source-snapshot.json","sha256":"9f5c6275d66f0fbc523ff8a1c3e338728eaebc1a0a0ab3a410736ea3195faa4f","status":"current"},{"generating_phase":"P2","input_artifact_sha256s":["5d6c500938980a7cd46ab70f451ca2f619361d66aa0296d2693153cb3e2ec925"],"media_type":"text/markdown","path":"promax-worldview-capsule.locked.md","sha256":"8d6a71be235ffe57b308093b8de778c2310eeac447f53b63bdb3f9fcabdc222e","status":"current"}],"generated_at":"2026-07-23T08:54:20Z","manifest_sha256":"61fe7130feb29789215448d16cad8bccb09b4200d480916f798684895f348a0b","mode":"promax-complete","orchestration_mode":"single-agent-separated","phase_chain_head_sha256":"3bbe4c6eba4e246a3ccd34f6c4e520b4ccc2f436fc142e5377f19992c3c6ecab","request_sha256":"b9f79081b8f9c5e5b89d7230094a3e51efa2a3d19060d03fd5b4c72e7afdc769","role_records":[{"exchange_protocol":"structured-artifacts-only","execution_mode":"single-agent-separated","input_artifacts":[{"media_type":"application/json","path":"promax-local-world-model.locked.json","sha256":"a5a3a0b64012c0ad08298f9ea2784f3e7460ad1db51cbb4d25d1f6bd206c7102"}],"observed_input_artifacts":[{"media_type":"application/json","path":"promax-local-world-model.locked.json","sha256":"a5a3a0b64012c0ad08298f9ea2784f3e7460ad1db51cbb4d25d1f6bd206c7102"}],"output_artifacts":[{"media_type":"application/json","path":"promax-concept-disposition-ledger.json","sha256":"f137e63bf72407a2ebd4e0a88c86e39b012722f760fcb35b7fbb747a727f68a1"}],"role_id":"v8_source_concept_auditor","sequence":1,"status":"completed"},{"exchange_protocol":"structured-artifacts-only","execution_mode":"single-agent-separated","input_artifacts":[{"media_type":"application/json","path":"promax-claim-path-graph.json","sha256":"697f77250b70ffe1a4282229607f4d59e1f94dab0a4953d5904cc8ee34edd4b4"}],"observed_input_artifacts":[{"media_type":"application/json","path":"promax-claim-path-graph.json","sha256":"697f77250b70ffe1a4282229607f4d59e1f94dab0a4953d5904cc8ee34edd4b4"}],"output_artifacts":[{"media_type":"application/json","path":"promax-retrieval-ledger.json","sha256":"0c0430c4bec5185238e642371c9646632bfbeedc30d0ad1cfa02c4705f7ec617"}],"role_id":"external_case_researcher","sequence":2,"status":"completed"},{"exchange_protocol":"structured-artifacts-only","execution_mode":"single-agent-separated","input_artifacts":[{"media_type":"application/json","path":"promax-retrieval-ledger.json","sha256":"0c0430c4bec5185238e642371c9646632bfbeedc30d0ad1cfa02c4705f7ec617"}],"observed_input_artifacts":[{"media_type":"application/json","path":"promax-retrieval-ledger.json","sha256":"0c0430c4bec5185238e642371c9646632bfbeedc30d0ad1cfa02c4705f7ec617"}],"output_artifacts":[{"media_type":"application/json","path":"promax-red-team-report.json","sha256":"6c9a3a1c32a6562215f5f0ef98c0ab7023ac144fd734973f1338b880fd1fb6ca"}],"role_id":"counterexample_auditor","sequence":3,"status":"completed"},{"exchange_protocol":"structured-artifacts-only","execution_mode":"single-agent-separated","input_artifacts":[{"media_type":"application/json","path":"promax-red-team-report.json","sha256":"6c9a3a1c32a6562215f5f0ef98c0ab7023ac144fd734973f1338b880fd1fb6ca"}],"observed_input_artifacts":[{"media_type":"application/json","path":"promax-red-team-report.json","sha256":"6c9a3a1c32a6562215f5f0ef98c0ab7023ac144fd734973f1338b880fd1fb6ca"}],"output_artifacts":[{"media_type":"application/json","path":"promax-position.locked.json","sha256":"df2ce3fb6d1bf1cb6933fda1c63e0ea717a7841f6679d2e3435179278aa284b1"}],"role_id":"position_adjudicator","sequence":4,"status":"completed"},{"exchange_protocol":"structured-artifacts-only","execution_mode":"single-agent-separated","input_artifacts":[{"media_type":"application/json","path":"promax-output-plan.locked.json","sha256":"fd17b4a4eecf0d5662460378e84265009ecd6978c1d341ee38e5d90304878f23"}],"observed_input_artifacts":[{"media_type":"application/json","path":"promax-output-plan.locked.json","sha256":"fd17b4a4eecf0d5662460378e84265009ecd6978c1d341ee38e5d90304878f23"}],"output_artifacts":[{"media_type":"text/markdown","path":"promax-essay.md","sha256":"dc69659fe01457351c6f7a25205b3af6db5f3f292106af86eb635b60e42d1712"}],"role_id":"longform_writer","sequence":5,"status":"completed"}],"run_contract_sha256":"ce3cb6a821c941be13fdf2b2378d9f2a1fba8cd67aa8fee9d8218ba709cccf90","run_id":"promax-run-dd7c57f21d368fd0","run_nonce":"6bd819364a020d88617a19fe1d316087893366bb613c571a8834ceb4cf030ecf","schema_id":"crossframe.promax.v8.artifact-manifest","schema_version":1,"source_snapshot_sha256":"3186805a3e46e1b16948a4e51d08e7693a8e0dd04aa6b4604e796266d649936c"}
